{"rule_id": 514, "name": "Gamaredon APT Group Use Covid-19 Lure in Campaigns - TrendLabs Security Intelligence Blog", "description": "-", "references": [], "File_Names": ["PlayList.vbs", "Cookies.txt", "Win32.REMC", "W97M_VBSDOWNLDR.ZKHC", "Cookies.exe", "Trojan.XML", "W97M_VBSDOWNLDR.ZYHC"], "MD5_Hashes": [], "SHA1_Hashes": ["ab533d6ca0c2be8860a0f7fbfc7820ffd595edc6", "315e297ac510f3f2a60176f9c12fcf92681bbad7", "3f40d4a0d0fe1eea58fa1c71308431b5c2ce6e38"], "SHA256_Hashes": ["f577d2b97963b717981c01b535f257e03688ff4a918aa66352aa9cd31845b67d", "036c2088cb48215f21d4f7d751d750b859d57018c04f6cadd45c0c4fee23a9f8", "9cd5fa89d579a664c28da16064057096a5703773cef0a079f228f21a4b7fd5d2", "84e0b1d94a43c87de55c000e3acae17f4493a57badda3b27146ad8ed0f90c93e", "250b09f87fe506fbc6cedf9dbfcb594f7795ed0e02f982b5837334f09e8a184b", "c089ccd376c9a4d5e5bdd553181ab4821d2c26fefc299cce7a4f023a660484d5", "85267e52016b6124e4e42f8b52e68475174c8a2bdf0bc0b501e058e2d388a819", "cc775e3cf1a64effa55570715b73413c3ea3a6b47764a998b1272b5be059c25b", "00b761bce25594da4c760574d224589daf01086c5637042982767a13a2f61bea", "e888b5e657b41d45ef0b2ed939e27ff9ea3a11c46946e31372cf26d92361c012", "19d03a25af5b71e859561ff8ccc0a073acb9c61b987bdb28395339f72baf46b4", "b6a94f565d482906be7da4d801153eb4dab46d92f43be3e1d59ddd2c7f328109", "0d90fe36866ee30eb5e4fd98583bc2fdb5b7da37e42692f390ac5f807a13f057", "8310d39aa1cdd13ca82c769d61049310f8ddaea7cd2c3b940a8a3c248e5e7b06", "62cf22f840fffd8d8781e52b492b03b4efc835571b48823b07535d52b182e861", "946405e2f26e1cc0bd22bc7e12d403da939f02e9c4d8ddd012f049cf4bf1fda9", "4b3ae36b04d6aba70089cb2099e6bc1ba16d16ea24bbf09992f23260151b9faf"], "Registry_Entries": ["HKEY_CURRENT_USER\\Software\\Microsoft\\Windows\\CurrentVersion\\RunOnce\\MediaPlayer wscript.exe //b\n\uff05USERPROFILE%\\Documents\\MediaPlayer\\PlayList.vbs\n\n2. Connect with \u201chxxp:// kristom[.]hopto[.]org /{computer name}_{hexadecimal volume serious number}/help_05_03[.]php\u201d (MITRE ATT&CK framework IDs\n\nT1043, T1071, T1082)\n\n3. If the downloaded \ufb01le size in the \ufb01rst step exceeds 10,485 bytes, then the \ufb01le is saved as \u201c%APPDATA%\\\\Microsoft\\Windows\\Cookies.txt\u201d (MITRE ATT&CK\n\nframework ID T1105)\n\n4. Use XOR for the \ufb01le saved from the second step, where ASCII code converted from its own hexadecimal volume serial number is used as the key. The\n\ndecrypted result is saved as \u201c%APPDATA%\\\\Microsoft\\Windows\\Cookies.exe\u201d (T1001)\n\n5. If the \ufb01le size of \u201c%APPDATA%\\\\Microsoft\\Windows\\Cookies.exe\u201d exceeds 4,485 bytes, it is executed.\n6. Both \u201c%APPDATA%\\\\Microsoft\\Windows\\Cookies.txt\u201d and \u201c%APPDATA%\\\\Microsoft\\Windows\\Cookies.exe\u201d are then deleted (MITRE ATT&CK\n\nframework ID T1107)\n\nThe observed routines of this VBS closely follow the other reports published on Gamaredon, such as the one from SentinelOne. However, the macro generated VBS\nwas obfuscated in this case, likely as an additional evasive tactic.\n\nInterestingly, after decoding the VBS, we saw what appeared to be a programming mistake by the attacker. Lines 53 and 54 in \ufb01gure 6 are for closing those\ndownloaded and decoded TXT and EXE \ufb01les, which are variables de\ufb01ned right before the IF statement. If, however, these lines do not pass through this IF statement,\nan error would occur. It shows that this malware is not tested enough, and may still be under development.\n\nOur analysis found several URLs of the network destinations for both template injection and VBS. While resolving them to IP addresses to understand their attack\nbases, we also found that they were all linked to the following IP addresses.\n\nNetwork destination for template injection: 176[.]119[.]147[.]225\nNetwork destination for VBS: 176[.]57[.]215[.]115\n\nThese IP addresses are from Russian hosting companies. Most likely, the attackers rented Virtual Private Server (VPS) as their attack base. Their URL for VBS\n(shown below) likely includes the data when they conducted the attack.\n\nhxxp://{FQDN}/{computer name}_{hexadecimal volume serial number}/help_{day}_{month}[.]php\n\nConclusion\n\nGameradon is not the \ufb01rst group to take advantage of the Covid-19 topic. Some cybercriminals have taken to indirect means of pro\ufb01ting, such as by targeting\ncommunication platforms that have increased in popularity after organizations shifted to work from home setups. In this case, they used Covid-19 as a cover for their\nrelatively typical APT routine. We recommend these countermeasures to prevent similar APT attacks in the future:\n\nhttps://blog.trendmicro.com/trendlabs-security-intelligence/gamaredon-apt-group-use-covid-19-lure-in-campaigns/?fbclid=IwAR2SzsXuDFjCsID7AdOyoE_U\u2026 3/7\n\n\f4/27/2020\n\nGamaredon APT Group Use Covid-19 Lure in Campaigns - TrendLabs Security Intelligence Blog\n\nCheck the email sender, subject, and body for anything suspicious before downloading and opening email attachments. Be especially wary of unsolicited\nemails, that come from unknown senders.\nCheck the \ufb01le extension of the attached \ufb01le and make sure it is the intended \ufb01le format.\nAvoid activating macro for any attached Microsoft Of\ufb01ce \ufb01les, especially for emails that request macro activation using an image of the body of the opened \ufb01le\nor those that don\u2019t show anything.\nWatch out for spoofed domains embedded in emails before opening them. Subtle changes to a popular URL can be one indicator of malicious content.\n\nIn addition to these actions, users can also implement a multi-layer approach and take advantage of these solutions.\n\nTrend Micro\u2122 Smart Protection Suitesand\u00a0Worry-Free\u2122 Business Security\u00a0protects users and businesses from similar threats by detecting malicious \ufb01les and\nspammed messages as well as blocking all related malicious URLs.\u00a0Trend Micro Deep Discovery\u2122\u00a0has an email inspection layer that can protect enterprises\nby detecting malicious attachments and URLs.\nTrend Micro\u2122 Hosted Email Securityis a no-maintenance cloud solution that delivers continuously updated protection to stop spam, malware, spear phishing,\nransomware, and advanced targeted attacks before they reach the network. It protects Microsoft Exchange,\u00a0Microsoft Of\ufb01ce 365, Google Apps, and other\nhosted and on-premises email solutions.\nTrend Micro\u2122 Of\ufb01ceScan\u2122with\u00a0XGen\u2122\u00a0endpoint security infuses high-\ufb01delity machine learning with other detection technologies and global threat\nintelligence for comprehensive protection against advanced malware.\nThe\u00a0Trend MicroTMXDR\u00a0solution effectively protects connected emails, endpoints, servers, cloud workloads, and networks. Trend Micro XDR uses powerful\nAI and expert security analytics to correlate data, as well as deliver fewer yet higher-\ufb01delity alerts for early threat detection. In a single console, it provides a\nbroader perspective of enterprise systems while at the same time giving a more focused and optimized set of alerts.\n\nIndicators of Compromise (IoCs)\n\nDOCX \ufb01le\n\nSHA256\n\nDetection Name\n\n0d90fe36866ee30eb5e4fd98583bc2fdb5b7da37e42692f390ac5f807a13f057\n\nW97M_CVE2017019\n\n036c2088cb48215f21d4f7d751d750b859d57018c04f6cadd45c0c4fee23a9f8\n\nTrojan.W97M.CVE2\n\n19d03a25af5b71e859561ff8ccc0a073acb9c61b987bdb28395339f72baf46b4\n\nTrojan.XML.PHISH.\n\n62cf22f840fffd8d8781e52b492b03b4efc835571b48823b07535d52b182e861\n\nW97M_CVE2017019\n\n8310d39aa1cdd13ca82c769d61049310f8ddaea7cd2c3b940a8a3c248e5e7b06\n\nTrojan.W97M.CVE2\n\n84e0b1d94a43c87de55c000e3acae17f4493a57badda3b27146ad8ed0f90c93e\n\nTrojan.W97M.CVE2\n\n85267e52016b6124e4e42f8b52e68475174c8a2bdf0bc0b501e058e2d388a819\n\nTrojan.W97M.CVE2\n\nb6a94f565d482906be7da4d801153eb4dab46d92f43be3e1d59ddd2c7f328109\n\nTrojan.W97M.CVE2\n\ncc775e3cf1a64effa55570715b73413c3ea3a6b47764a998b1272b5be059c25b\n\nTrojan.W97M.CVE2\n\nDOT \ufb01le\nSHA256\n00b761bce25594da4c760574d224589daf01086c5637042982767a13a2f61bea\n250b09f87fe506fbc6cedf9dbfcb594f7795ed0e02f982b5837334f09e8a184b\n4b3ae36b04d6aba70089cb2099e6bc1ba16d16ea24bbf09992f23260151b9faf\n946405e2f26e1cc0bd22bc7e12d403da939f02e9c4d8ddd012f049cf4bf1fda9\n9cd5fa89d579a664c28da16064057096a5703773cef0a079f228f21a4b7fd5d2\nc089ccd376c9a4d5e5bdd553181ab4821d2c26fefc299cce7a4f023a660484d5\n\ne888b5e657b41d45ef0b2ed939e27ff9ea3a11c46946e31372cf26d92361c012\n\nf577d2b97963b717981c01b535f257e03688ff4a918aa66352aa9cd31845b67d\n\nDetection Name\nMal_OLEMAL-4\nMal_OLEMAL-4\nMal_OLEMAL-4\nMal_OLEMAL-4\nMal_OLEMAL-4\nMal_OLEMAL-4\nW97M_VBSDOWNLDR.ZKHC-\nA\nW97M_VBSDOWNLDR.ZYHC-\nA\n\nTrendX\n\nDownloader.VBA.TRX.XXVBAF01FF00\n7\n\nhttps://blog.trendmicro.com/trendlabs-security-intelligence/gamaredon-apt-group-use-covid-19-lure-in-campaigns/?fbclid=IwAR2SzsXuDFjCsID7AdOyoE_U\u2026 4/7\n\n\f4/27/2020\n\nGamaredon APT Group Use Covid-19 Lure in Campaigns - TrendLabs Security Intelligence Blog\n\nSHA256\n17161e0ab3907f637c2202a384de67fca49171c\n79b1b24db7c78a4680637e3d5\n29367502e16bf1e2b788705014d0142d8bcb7fc\nc6a47d56fb82d7e333454e923\n315e297ac510f3f2a60176f9c12fcf92681bbad7\n58135767ba805cdea830b9ee\n3e6166a6961bc7c23d316ea9bca87d8287a4044\n865c3e73064054e805ef5ca1a\n3f40d4a0d0fe1eea58fa1c71308431b5c2ce6e38\n1cacc7291e501f4eed57bfd2\nab533d6ca0c2be8860a0f7fbfc7820ffd595edc6\n3e540ff4c5991808da6a257d\nb78a3d21325d3db7470fbf1a6d254e23d349531\nfca4d7f458b33ca93c91e61cd\nc9c0180eba2a712f1aba1303b90cbf12c111745\n1ce13b68715931abc437b10cd\n\nDetection Name\nTrojan.X97M.CVE20171\n1882.THCOCBO\nTrojanSpy.Win32.FAREI\nT.UHBAZCLIZ\nTrojan.X97M.CVE20171\n1882.THCOCBO\nBackdoor.Win32.REMC\nOS.USMANEAGFG\nTrojan.MSIL.AGENTTE\nSLA.THCOCBO\nTrojan.X97M.CVE20171\n1882.THCOCBO\nBackdoor.Win32.REMC\nOS.USMANEAGFE\nTrojanSpy.Win32.FAREI\nT.UHBAZCLIZ\n\nTrendX\nDownloader.VBA.TRX\n.XXVBAF01FF006\n\nN/A\n\nDownloader.VBA.TRX\n.XXVBAF01FF006\nTroj.Win32.TRX.XXP\nE50FFF034\n\nN/A\n\nN/A\n\nTroj.Win32.TRX.XXP\nE50FFF034\nTroj.Win32.TRX.XXP\nE50FFF034\n\nC&C addresses\n\nBambinos[.]bounceme[.]net\nbbtt[.]site\nbbtt[.]space\nharpa[.]site\nharpa[.]space\nharpa[.]website\nhimym[.]site\nkristoffer[.]hopto[.]org\nkristom[.]hopto[.]org\nmiragena[.]site\nmiragena[.]xyz\npapir[.]hopto[.]org\nsabdja[.]3utilities[.]com\nsakira[.]3utilities[.]com\nseliconos[.]3utilities[.]com\nsolod[.]bounceme[.]net\nsonik[.]hopto[.]org\ntele[.]3utilities[.]com\nviolina[.]website\nvoyager[.]myftp[.]biz\nvoyaget[.]myftp[.]biz\n\nMitre ATT&CK Framework\n\nRelated Posts:\n\nOperation ENDTRADE: Finding Multi-Stage Backdoors that TICK\nSpam Campaign Targets Colombian Entities with Custom-made \u2018Proyecto RAT,\u2019 Uses Email Service YOPmail for C&C\nMac Backdoor Linked to Lazarus Targets Korean Users\nOutlaw Updates Kit to Kill Older Miner Versions, Targets More Systems\n\nLearn how to protect Enterprises, Small Businesses, and Home Users from ransomware:\n\nENTERPRISE\n\n\u00bb\n\nSMALL BUSINESS\n\n\u00bb\n\nHOME\n\n\u00bb\n\nTags: APT\n\nhttps://blog.trendmicro.com/trendlabs-security-intelligence/gamaredon-apt-group-use-covid-19-lure-in-campaigns/?fbclid=IwAR2SzsXuDFjCsID7AdOyoE_U\u2026 5/7\n\n\f4/27/2020\n\nGamaredon APT Group Use Covid-19 Lure in Campaigns - TrendLabs Security Intelligence Blog\n\n0 Comments\n\nTrendLabs\n\n\ud83d\udd12\u00a0Privacy Policy\n\n\uf108\n\n Recommend\n\nt Tweet f Share\n\nLogin\ue6031\n\nSort by Best\n\nStart the discussion\u2026\n\nLOG IN WITH\n\nOR SIGN UP WITH DISQUS \n\n?\n\nName\n\n\u2709\n\nSubscribe\n\nd\n\nAdd Disqus to your siteAdd DisqusAdd\n\n\u26a0\n\nD N t S ll M D t\n\nSecurity Predictions for 2020\n\nCybersecurity in 2020 will be viewed through many lenses \u2014 from differing attacker motivations and cybercriminal arsenal to technological developments and\nglobal threat intelligence \u2014 only so defenders can keep up with the broad range of threats.\nRead our security predictions for 2020.\n\nBusiness Process Compromise\n\nAttackers are starting to invest in long-term operations that target speci\ufb01c processes enterprises rely on. They scout for vulnerable practices, susceptible\nsystems and operational loopholes that they can leverage or abuse. To learn more, read our Security 101: Business Process Compromise.\n\nRecent Posts\n\nExposed Redis Instances Abused for Remote Code Execution, Cryptocurrency Mining\nGrouping Linux IoT Malware Samples With Trend Micro ELF Hash\nGamaredon APT Group Use Covid-19 Lure in Campaigns\nExposing Modular Adware: How DealPly, IsErIk, and ManageX Persist in Systems\nApril Patch Tuesday: Fixes for Font-Related, Microsoft SharePoint, Windows Components Vulnerabilities\n\nPopular Posts\n\nMore Than 8,000 Unsecured Redis Instances Found in the Cloud\n\nRaccoon Stealer\u2019s Abuse of Google Cloud Services and Multiple Delivery Techniques\n\nDissecting Geost: Exposing the Anatomy of the Android Trojan Targeting Russian Banks\n\nOperation Poisoned News: Hong Kong Users Targeted With Mobile Malware via Local News Links\n\nCoronavirus Update App Leads to Project Spy Android and iOS Spyware\n\nStay Updated\n\nEmail Subscription\nYour email here\n\nSubscribe\n\nHome and Home Of\ufb01ce\n|\nFor Business\n|\nSecurity Intelligence\n|\nAbout Trend Micro\n\nAsia Paci\ufb01c Region (APAC): Australia / New Zealand, \u4e2d\u56fd, \u2f47\u672c, \ub300\ud55c\ubbfc\uad6d, \u53f0\u7063\nLatin America Region (LAR): Brasil, M\u00e9xico\nNorth America Region (NABU): United States, Canada \nEurope, Middle East, & Africa Region (EMEA): France, Deutschland / \u00d6sterreich / Schweiz, Italia, \u0420\u043e\u0441\u0441\u0438\u044f, Espa\u00f1a, United Kingdom / Ireland\n\nhttps://blog.trendmicro.com/trendlabs-security-intelligence/gamaredon-apt-group-use-covid-19-lure-in-campaigns/?fbclid=IwAR2SzsXuDFjCsID7AdOyoE_U\u2026 6/7\n\nBe the \ufb01rst to comment.\f4/27/2020\n\nGamaredon APT Group Use Covid-19 Lure in Campaigns - TrendLabs Security Intelligence Blog\n\nPrivacy Statement\nLegal Policies\n\nCopyright \u00a9 2020 Trend Micro Incorporated. All rights reserved.\n\nhttps://blog.trendmicro.com/trendlabs-security-intelligence/gamaredon-apt-group-use-covid-19-lure-in-campaigns/?fbclid=IwAR2SzsXuDFjCsID7AdOyoE_U\u2026 7/7\n\n\f"], "URLs": ["https://blog.trendmicro.com/trendlabs-security-intelligence/gamaredon-apt-group-use-covid-19-lure-in-campaigns/?fbclid=IwAR2SzsXuDFjCsID7AdOyoE_U"], "weight": 0.0}