{"rule_id": 314, "name": "WastedLocker_ A New Ransomware Variant Developed By The Evil Corp Group \u2013 NCC Group Research", "description": "-", "references": [], "File_Names": ["paiolets.com", "winsat.exe", "websitelistbuilder.com", "uplandcaraudio.xyz", "kordelservers.xyz", "wineguroo.xyz", "respondcritique.xyz", "lendojekam.xyz", "woofwoofacademy.xyz", "celebratering.xyz", "bettyware.xyz", "consultane.com", "proactiveads.be", "triomigratio.xyz", "nccgroup.com", "justbesarnia.xyz", "jquery.com", "typiconsult.com", "takeown.exe", "fakeframes.xyz", "gate.php", "install.exe", "tritravlife.xyz", "lpequdeliren.fun", "veisllc.xyz", "lck.log", "amazingdonutco.com", "hodonin.info", "mwebsoft.com", "hotphonecall.xyz", "utenti.live", "tutanota.com", "rostraffic.com", "ludwoodgroup.xyz", "gadgetops.xyz", "utenti.info", "transvil2.xyz", "netsh.exe", "adsmarketart.com", "traffichi.com", "winmm.dll", "advertstv.com", "advancedanalysis.be", "cofeedback.com", "devicelease.xyz", "flablenitev.site", "guiapocos.xyz", "penaz.info", "2.min", "lgrarcosbann.club"], "MD5_Hashes": ["2143d279be8d1bb4110b7ebe8dc3afbc", "fb95561e8ed7289d015e945ad470e6db", "198b2443827f771f216cd8463c25c5d8", "b33753fae7bd1e68e0b1cc712b5fb867"], "SHA1_Hashes": [], "SHA256_Hashes": ["5cd04805f9753ca08b82e88c27bf5426d1d356bb26b281885573051048911367", "adabf8c1798432b766260ac42ccdd78e0a4712384618a2fc2e3695ff975b0246", "6088e7131b1b146a8e573c096386ff36b19bfad74c881ca68eda29bd4cea3339", "ba71ddcab00697f42ccc7fc67c7a4fccb92f6b06ad02593a972d3beb8c01f723", "c20292af49b1f51fac1de7fd4b5408ed053e3ebfcb4f0566a2d4e7fafadde757", "887aac61771af200f7e58bf0d02cb96d9befa11deda4e448f0a700ccb186ce9d", "2f72550c99a297558235caa97d025054f70a276283998d9686c282612ebdbea0", "8897db876553f942b2eb4005f8475a232bafb82a50ca7761a621842e894a3d80", "14f2890a18656e4e766aded0a2267ad1c08a9db11e0e5df34054f6d8de749fe7", "b0354649de6183d455a454956c008eb4dec093141af5866cc9ba7b314789844d", "bc1c5fecadc752001826b736810713a86cfa64979b3420ab63fe97ba7407f068", "810576224c148d673f47409a34bd8c7f743295d536f6d8e95f22ac278852a45f", "5706e1b595a9b7397ff923223a6bc4e4359e7b1292eaed5e4517adc65208b94b", "714e0ed61b0ae779af573dce32cbc4d70d23ca6cfe117b63f53ed3627d121feb", "91e18e5e048b39dfc8d250ae54471249d59c637e7a85981ab0c81cf5a4b8482d", "e3bf41de3a7edf556d43b6196652aa036e48a602bb3f7c98af9dae992222a8eb", "3dfb4e7ca12b7176a0cf12edce288b26a970339e6529a0b2dad7114bba0e16c3", "c7cde31daa7f5d0923f9c7591378b4992765eac12efa75c1baaaefa5f6bdb2b6", "83710bbb9d8d1cf68b425f52f2fb29d5ebbbd05952b60fb3f09e609dfcf1976c", "ed0632acb266a4ec3f51dd803c8025bccd654e53c64eb613e203c590897079b3", "cf744b04076cd5ee456c956d95235b68c2ec3e2f221329c45eac96f97974720a", "bcdac1a2b67e2b47f8129814dca3bcf7d55404757eb09f1c3103f57da3153ec8", "389f2000a22e839ddafb28d9cf522b0b71e303e0ae89e5fc2cd5b53ae9256848", "c781c56d8c8daedbed9a15fb2ece165b96fdda1a85d3beeba6bb3bc23e917c90", "f093b0006ef5ac52aa1d51fee705aa3b7b10a6af2acb4019b7bc16da4cabb5a1"], "Registry_Entries": ["HKEY_LOCAL_MACHINE\\SYSTEM\\CurrentControlSet\\Control\nand then separates their names whenever a capital letter is found. For example, the\nregistry key AppReadiness will be separated to two words, App and Readiness.\n\n4.4 Strings Encryption\n\nThe strings pertaining to the ransomware are encrypted and stored in the .bss section of\nthe binary file. This includes the ransom note along with other important information\nnecessary for the ransomware\u2019s tasks. The strings are decrypted using a key that\ncombined the size and raw address of the .bss section, as well as the ransomware\u2019s\ncompilation timestamp.\n\nThe code\u2019s authors use an interesting method to locate the encrypted strings related to the\nencryption process. To locate one of them, the ransomware calculates a checksum that is\nlooked up in the encrypted strings table. The checksum is derived from both a constant\nvalue that is unique to each string and a fixed value, which are bitwise XORed. The\nencrypted strings table consists of a struct like shown below for each string.\n\nstruct ransomware_string \n{ \nWORD total_size; // string_length + checksum + ransom_string \nWORD string_length; \nDWORD Checksum;  \nBYTE[string_length] ransom_string; \n};\n\n4.5 Encryption Process\n\nThe encryption process is quite straightforward. The ransomware targets the following\ndrive types:\n\nRemovable\nFixed\nShared\nRemote\n\nInstead of including a list of extension targets, WastedLocker includes a list of directories\nand extensions to exclude from the encryption process. Files with a size less than 10 bytes\nare also ignored and in case of a large file, the ransomware encrypts them in blocks of\n64MB.\n\nOnce a drive is found, the ransomware starts searching for and encrypting files. Each file\nis encrypted using the AES algorithm with a newly generated AES key and IV (256-bit in\nCBC mode) for each file. The AES key and IV are encrypted with an embedded public RSA\nkey (4096 bits). The RSA encrypted output of key material is converted to base64 and\nthen stored into the ransom note.\n\nhttps://research.nccgroup.com/2020/06/23/wastedlocker-a-new-ransomware-variant-developed-by-the-evil-corp-group/\n\n8/21\n\n\f6/30/2020\n\nWastedLocker: A New Ransomware Variant Developed By The Evil Corp Group \u2013 NCC Group Research\n\nFor each encrypted file, the ransomware creates an additional file that includes the\nransomware note. The encrypted file\u2019s extension is set according to the targeted\norganisations name along with the prefix wasted (hence the name we have gave to this\nransomware). For example, test.txt.orgnamewasted (encrypted data) and\ntest.txt.orgnamewasted_info (ransomware note). The ransomware note and the list\nof excluded directories and extensions is available in the Appendix. Finally, once the\nencryption of each file has been completed, the ransomware updates the log file with the\nfollowing information:\n\nNumber of targeted files\nNumber of files which were encrypted\nNumber of files which were not encrypted due to access rights issues\n\n4.6 WastedLocker Decrypter\n\nDuring our analysis, we managed to identify a decrypter for WastedLocker. The decrypter\nrequires administrator privileges and similarl to the encryption process, it reports the\nnumber of files which were successfully decrypted (Figure 3).\n\nFigure 3: Command line output of the decrypter of WastedLocker\n\nReferences\n\n1. hxxps://medium.com/tenable-techblog/uac-bypass-by-mocking-trusted-\n\ndirectories-24a96675f6e\n\n2. hxxps://github.com/hfiref0x/UACME\n3. hxxps://github.com/TheWover/donut/\n\nAppendix\n\nRansom note\n\n*ORGANIZATION_NAME* \n\nYOUR NETWORK IS ENCRYPTED NOW \n\nUSE *EMAIL1* | *EMAIL2* TO GET THE PRICE FOR YOUR DATA \n\nDO NOT GIVE THIS EMAIL TO 3RD PARTIES \n\nDO NOT RENAME OR MOVE THE FILE \n\nTHE FILE IS ENCRYPTED WITH THE FOLLOWING KEY: \n[begin_key]*[end_key] \nKEEP IT\n\nhttps://research.nccgroup.com/2020/06/23/wastedlocker-a-new-ransomware-variant-developed-by-the-evil-corp-group/\n\n9/21\n\n \n \n \n \n \n\f6/30/2020\n\nWastedLocker: A New Ransomware Variant Developed By The Evil Corp Group \u2013 NCC Group Research\n\nExcluded extensions (in addition to orgnamewasted and orgnamewasted_info)\n\n*\\ntldr \n*.386 \n*.adv \n*.ani \n*.bak \n*.bat \n*.bin \n*.cab \n*.cmd \n*.com \n*.cpl \n*.cur \n*.dat \n*.diagcab \n*.diagcfg \n*.dll \n*.drv \n*.exe \n*.hlp \n*.hta \n*.icl \n*.icns \n*.ics \n*.idx \n*.ini \n*.key \n*.lnk \n*.mod \n*.msc \n*.msi \n*.msp \n*.msstyles \n*.msu \n*.nls \n*.nomedia \n*.ocx \n*.ps1 \n*.rom \n*.rtp \n*.scr \n*.sdi \n*.shs \n*.sys \n*.theme \n*.themepack \n*.wim \n*.wpx \n*\\bootmgr \n*\\grldr\n\nExcluded directories\n\nhttps://research.nccgroup.com/2020/06/23/wastedlocker-a-new-ransomware-variant-developed-by-the-evil-corp-group/\n\n10/21\n\n\f6/30/2020\n\nWastedLocker: A New Ransomware Variant Developed By The Evil Corp Group \u2013 NCC Group Research\n\n*\\$recycle.bin* \n*\\appdata* \n*\\bin* \n*\\boot* \n*\\caches* \n*\\dev* \n*\\etc* \n*\\initdr* \n*\\lib* \n*\\programdata* \n*\\run* \n*\\sbin* \n*\\sys* \n*\\system volume information* \n*\\users\\all users* \n*\\var* \n*\\vmlinuz* \n*\\webcache* \n*\\windowsapps* \nc:\\program files (x86)* \nc:\\program files* \nc:\\programdata* \nc:\\recovery* \nc:\\users\\ %USERNAME%\\appdata\\local\\temp* \nc:\\users\\ %USERNAME%\\appdata\\roaming* \nc:\\windows*\n\nIoCs\n\nIoCs related to targeted ransomware attacks are a generally misunderstood concept in the\ncase of targeted ransomware. Each ransomware victim has a custom build configured or\ncompiled for them and so the knowing the specific hashes used against historic victims\ndoes not provide any protection at all. Even if behavioural patterns of the ransomware or\nnetwork related indicators of the ransomware stage are given (should they exist), it is\narguable whether detection of the attack at that stage would allow prevention of the actual\nattack. We do include known ransomware hashes here; however, please note that these\nare for RESEARCH PURPOSES ONLY. Blocking files based on these file attributes in any\nendpoint protection product will not provide any value.\n\nAt Fox-IT we focus mainly on detection of the initial stages of such attacks (such as the\ninitial stage of infection) by detecting the various methods of infection delivery as well as\nthe lateral movement stage which typically involves scanning, exploitation and/or\ncredential dumping. Providing these IoCs to the wider public would, however, be\ncounterproductive as the threat actors would simply change these methods or work\naround the indicators. However, we have included some of them to provide historical as\nwell as current protection or detection against this particular threat, and provide a better\nunderstanding of this threat actor. It is also hoped this information will help other\norganisations to conduct further research into this particular threat.\n\nhttps://research.nccgroup.com/2020/06/23/wastedlocker-a-new-ransomware-variant-developed-by-the-evil-corp-group/\n\n11/21\n\n\f6/30/2020\n\nWastedLocker: A New Ransomware Variant Developed By The Evil Corp Group \u2013 NCC Group Research\n\nCobaltStrike\nThis particular set of domains is used as C&C by the group for CobaltStrike lateral\nmovement activity, using a custom loader, Note that in 2020 the group has completely\nswitched to using CobaltStrike and is no longer using the Empire PowerShell framework\nas it is no longer being updated by the original creators.\n\nCobaltStrike C&C Domains\n\nadsmarketart.com \nadvancedanalysis.be \nadvertstv.com \namazingdonutco.com \ncofeedback.com \nconsultane.com \ndns.proactiveads.be \nmwebsoft.com \nrostraffic.com \ntraffichi.com \ntypiconsult.com \nwebsitelistbuilder.com\n\nCobaltStrike Beacon config\n\nhttps://research.nccgroup.com/2020/06/23/wastedlocker-a-new-ransomware-variant-developed-by-the-evil-corp-group/\n\n12/21\n\n\f6/30/2020\n\nWastedLocker: A New Ransomware Variant Developed By The Evil Corp Group \u2013 NCC Group Research\n\nSETTING_PROTOCOL: short: 8 (DNS: 0, SSL: 1) \nSETTING_PORT: short: 443 \nSETTING_SLEEPTIME: int: 45000 \nSETTING_MAXGET: int: 1403644 \nSETTING_JITTER: short: 37 \nSETTING_MAXDNS: short: 255 \nSETTING_PUBKEY: '' \nSETTING_PUBKEY SHA256: \n14f2890a18656e4e766aded0a2267ad1c08a9db11e0e5df34054f6d8de749fe7 \nptr SETTING_DOMAINS: websitelistbuilder.com,/jquery-3.3.1.min.js \nptr SETTING_USERAGENT: Mozilla/5.0 (Windows NT 6.3; Trident/7.0; rv:11.0) like \nGecko \nptr SETTING_SUBMITURI: /jquery-3.3.2.min.js \nSETTINGS_C2_RECOVER: \n    print: True \n    append: 1522 \n    prepend: 84 \n    prepend: 3931 \n    base64url: True \n    mask: True \nSETTING_C2_REQUEST (transform steps): \n   _HEADER: Accept: \ntext/html,application/xhtml+xml,application/xml;q=0.9,*/*;q=0.8 \n   _HEADER: Referer: http://code.jquery.com/ \n   _HEADER: Accept-Encoding: gzip, deflate \n   BUILD: metadata \n   BASE64URL: True \n   PREPEND: __cfduid= \n   HEADER: Cookie \nSETTING_C2_POSTTREQ (transform steps): \n   _HEADER: Accept: \ntext/html,application/xhtml+xml,application/xml;q=0.9,*/*;q=0.8 \n   _HEADER: Referer: http://code.jquery.com/ \n   _HEADER: Accept-Encoding: gzip, deflate \n   BUILD: metadata \n   MASK: True \n   BASE64URL: True \n   PARAMETER: __cfduid \n   BUILD: output \n   MASK: True \n   BASE64URL: True \n   PRINT: True \nptr DEPRECATED_SETTING_SPAWNTO:  \nptr SETTING_SPAWNTO_X86: %windir%\\syswow64\\rundll32.exe \nptr SETTING_SPAWNTO_X64: %windir%\\sysnative\\rundll32.exe \nptr SETTING_PIPENAME:  \nSETTING_CRYPTO_SCHEME: short: 0 (CRYPTO_LICENSED_PRODUCT) \nSETTING_DNS_IDLE: int: 1249756273 \nSETTING_DNS_SLEEP: int: 0 \nptr SETTING_C2_VERB_GET: GET \nptr SETTING_C2_VERB_POST: POST \nSETTING_C2_CHUNK_POST: int: 0 \nSETTING_WATERMARK: int: 305419896 (0x12345678) \nSETTING_CLEANUP: short: 1 \nSETTING_CFG_CAUTION: short: 0 \nptr SETTING_HOST_HEADER:  \nSETTING_HTTP_NO_COOKIES: short: 1 \nSETTING_PROXY_BEHAVIOR: short: 2 \n\nhttps://research.nccgroup.com/2020/06/23/wastedlocker-a-new-ransomware-variant-developed-by-the-evil-corp-group/\n\n13/21\n\n\f6/30/2020\n\nWastedLocker: A New Ransomware Variant Developed By The Evil Corp Group \u2013 NCC Group Research\n\nSETTING_EXIT_FUNK: short: 0 \nSETTING_KILLDATE: int: 0 \nSETTING_GARGLE_NOOK: int: 154122 \nptr SETTING_GARGLE_SECTIONS: \n'`\\x02\\x00Q\\xfd\\x02\\x00\\x00\\x00\\x03\\x00\\xc0\\xa0\\x03\\x00\\x00\\xb0\\x03\\x000\\xce\\x03' \nSETTING_PROCINJ_PERMS_I: short: 4 \nSETTING_PROCINJ_PERMS: short: 32 \nSETTING_PROCINJ_MINALLOC: int: 17500 \nptr SETTING_PROCINJ_TRANSFORM_X86: '\\x02\\x90\\x90' \nptr SETTING_PROCINJ_TRANSFORM_X64: '\\x02\\x90\\x90' \nptr SETTING_PROCINJ_STUB: *p?'??7???] \nptr SETTING_PROCINJ_EXECUTE: BntdllRtlUserThreadStart \nSETTING_PROCINJ_ALLOCATOR: short: 1 \nDeduced metadata: \n WANTDNS: False \n SSL: True \n MAX ENUM: 55 \n Version: CobaltStrike v4.0 (Dec 5, 2019) \n\nCustom CobaltStrike loader samples (sha256 hashes):\n\n2f72550c99a297558235caa97d025054f70a276283998d9686c282612ebdbea0 \n389f2000a22e839ddafb28d9cf522b0b71e303e0ae89e5fc2cd5b53ae9256848 \n3dfb4e7ca12b7176a0cf12edce288b26a970339e6529a0b2dad7114bba0e16c3 \n714e0ed61b0ae779af573dce32cbc4d70d23ca6cfe117b63f53ed3627d121feb \n810576224c148d673f47409a34bd8c7f743295d536f6d8e95f22ac278852a45f \n83710bbb9d8d1cf68b425f52f2fb29d5ebbbd05952b60fb3f09e609dfcf1976c \n91e18e5e048b39dfc8d250ae54471249d59c637e7a85981ab0c81cf5a4b8482d \nadabf8c1798432b766260ac42ccdd78e0a4712384618a2fc2e3695ff975b0246 \nb0354649de6183d455a454956c008eb4dec093141af5866cc9ba7b314789844d \nbc1c5fecadc752001826b736810713a86cfa64979b3420ab63fe97ba7407f068 \nc781c56d8c8daedbed9a15fb2ece165b96fdda1a85d3beeba6bb3bc23e917c90 \nc7cde31daa7f5d0923f9c7591378b4992765eac12efa75c1baaaefa5f6bdb2b6 \nf093b0006ef5ac52aa1d51fee705aa3b7b10a6af2acb4019b7bc16da4cabb5a1\n\n.NET injector (Donut) (sha256 hash):\n\n6088e7131b1b146a8e573c096386ff36b19bfad74c881ca68eda29bd4cea3339 \n\nGozi ISFB v2\nThis particular set contains C&C domains, bot version, Group ID, RSA key and Serpent\nencryption keys for 2 Gozi variants used for persistence in victim networks during 2020.\n\nGozi C&C Domains\n\nbettyware.xyz \ncelebratering.xyz \nfakeframes.xyz \ngadgetops.xyz \nhotphonecall.xyz \njustbesarnia.xyz \nkordelservers.xyz \ntritravlife.xyz \nveisllc.xyz \nwineguroo.xyz\n\nhttps://research.nccgroup.com/2020/06/23/wastedlocker-a-new-ransomware-variant-developed-by-the-evil-corp-group/\n\n14/21\n\n\f6/30/2020\n\nWastedLocker: A New Ransomware Variant Developed By The Evil Corp Group \u2013 NCC Group Research\n\nGozi versions\n\n217119 \n217123\n\nGozi Group ID\n\n30000\n\nGozi RSA key\n\n00020000BEA9877343AD9F6EA8E122A5A540C071E96AB5E0C8D73991BFACB8D7867125966C60153EB13\n\nGozi serpent network encryption keys:\n\n8EzkwaSgkg565AyQ \neptDZELKvZUseoAH \nGbdG3H7PgSVEme2r \nRQ5btM2UfoCHAMKN\n\nGozi samples (sha256 hashes)\n\n5706e1b595a9b7397ff923223a6bc4e4359e7b1292eaed5e4517adc65208b94b \nba71ddcab00697f42ccc7fc67c7a4fccb92f6b06ad02593a972d3beb8c01f723 \nc20292af49b1f51fac1de7fd4b5408ed053e3ebfcb4f0566a2d4e7fafadde757 \ncf744b04076cd5ee456c956d95235b68c2ec3e2f221329c45eac96f97974720a\n\nWastedLocker samples (sha256 hashes)\n\n5cd04805f9753ca08b82e88c27bf5426d1d356bb26b281885573051048911367 \n887aac61771af200f7e58bf0d02cb96d9befa11deda4e448f0a700ccb186ce9d \n8897db876553f942b2eb4005f8475a232bafb82a50ca7761a621842e894a3d80 \nbcdac1a2b67e2b47f8129814dca3bcf7d55404757eb09f1c3103f57da3153ec8 \ne3bf41de3a7edf556d43b6196652aa036e48a602bb3f7c98af9dae992222a8eb \ned0632acb266a4ec3f51dd803c8025bccd654e53c64eb613e203c590897079b3\n\nThe following IoCs are specifically related to the crypter used by Evil Corp, which we refer\nto as CryptOne. Given that CryptOne is used by more malware families and variations\nthan just those related to Evil Corp it is likely that CryptOne is a third party service.\n\nList of metadata extracted from Gozi ISFB v3 samples\n\nhttps://research.nccgroup.com/2020/06/23/wastedlocker-a-new-ransomware-variant-developed-by-the-evil-corp-group/\n\n15/21\n\n\f6/30/2020\n\nWastedLocker: A New Ransomware Variant Developed By The Evil Corp Group \u2013 NCC Group Research\n\nBot\nver-\nsion\n\nRSA\nkey\n\n3.00.854\n\n00040000C3DC07D4E1AC941077214371F45B5FD-\nDDF389654D0851D66809BC989ABA850C27D3718D195EE1388087F21F-\nFE759184C185959D1AB5DBC40C3D94C88F46FE8AA1-\nCA94CB07CF110866559456F9DF6F1EAE9C3002F1A257A2F99E3EB3E-\nF6C727516BA65CE56C82E23CBBE87E1EE95F34DD7D-\nC0D07B7C1F57B71BC49DC35DEB2-\nCAB00000000000000000000000000000000000000000000000000000\n00000000000000000000000000000000000000000000000000000000\n00000000000000000000000000000000000000000000000000000000\n00000000000000000000000000000000000000000000000000000000\n00000000000000000000000000000010001\n\nGroup\nIDs\n\n202004081\n202004091\n202004141\n202004231\n202005041\n80000\n\nSer-\npent\nkeys\n\nC&Cs\n\n1qzRaTGYO5dpREYI\n8JbpEEfNYPlYoAN4\ndLwZ7QwI57AkzZEl\nUEwFH6L9iBbdJxAf\nuIIXQ4B05dT8AytD\nvuARb2EPotEtfAX2\nZ6fiC4XCvQmfkgua\n\nhxxps://devicelease.xyz\nhxxps://guiapocos.xyz\nhxxps://ludwoodgroup.xyz\nhxxps://respondcritique.xyz\nhxxps://triomigratio.xyz\nhxxps://uplandcaraudio.xyz\nhxxps://woofwoofacademy.xyz\n\nZLoader (MD5: fb95561e8ed7289d015e945ad470e6db)\n\nhttps://research.nccgroup.com/2020/06/23/wastedlocker-a-new-ransomware-variant-developed-by-the-evil-corp-group/\n\n16/21\n\n\f6/30/2020\n\nWastedLocker: A New Ransomware Variant Developed By The Evil Corp Group \u2013 NCC Group Research\n\nRC4 key\n\ndas32hfkAN3R2TCS\n\nBotnet name\n\nNonce\n\npref\n\n0x7\n\nStatic config RC4 key kyqvkjlpclbcnagbhiwo\n\nVersion\n\nC&Cs\n\n1.2.22.0\n\nhxxp://advokat-hodonin.info/gate.php\nhxxp://penaz.info/gate.php\n\nBinary Distribution\n\nhxxp://paiolets.com/install.exe\n\nNetwalker ransomware (MD5: 198b2443827f771f216cd8463c25c5d8)\n\nSmokeLoader (MD5: 2143d279be8d1bb4110b7ebe8dc3afbc)\n\nRC4 send\n\n0x69A84992\n\nRC4 recv\n\n0x5D7C6D5B\n\nC&Cs\n\nhxxp://flablenitev.site/index.php\nhxxp://lendojekam.xyz/index.php\nhxxp://lgrarcosbann.club/index.php\nhxxp://lpequdeliren.fun/index.php\nhxxp://transvil2.xyz/index.php\n\nBinary Distribution hxxps://szn.services/1.exe\n\nhxxps://utenti.info/1.exe\nhxxps://utenti.live/1.exe\n\nSecTool checker (MD5: b33753fae7bd1e68e0b1cc712b5fb867)\n\nWe have found a sample crypted by the CryptOne crypter as used by WastedLocker,\nwhich is capable of detecting/disabling a list of security software. It is believed that this\ntool is used during ransomware deployment, but we have no specific evidence that it was\nused by Evil Corp. However in the past we have seen execution of commands listed in the\ntool to disable Microsoft Windows Defender.\n\nhttps://research.nccgroup.com/2020/06/23/wastedlocker-a-new-ransomware-variant-developed-by-the-evil-corp-group/\n\n17/21\n\n\f6/30/2020\n\nWastedLocker: A New Ransomware Variant Developed By The Evil Corp Group \u2013 NCC Group Research\n\nList of\nReg-\nistry\nKeys\nchecked\n\nList of\nMutex\nchecked\n\nSoftware\\ESET\nSYSTEM\\ControlSet001\\Services\\MBAMService\n\n00082fbb-a419-43f4-bd80-e3631ebbf4c8\n069e4409-bd54-4a1f-8e37-49da2cf6a537\n0ca9a8d3-01bf-4f9e-bfc7-7eb51e67e0c4\n12a2c0fc-00d2-4614-b4ae-c18eb500a088\n138be83c-2a52-4c31-9ee8-bfd4eac53d72\n15417794-7485-46f6-9965-d34730ea0f48\n168cb052-69eb-45be-be07-d4f323dc67d6\n16ed8dab-ee6b-44ea-8cea-31c66d6864b9\n172821eb-729d-4307-a56f-63063b2677de\n17689d7a-89bf-4e2a-a49c-9e4e5a51a9d7\n197a1689-8bb1-4fcd-80e9-32b86e3751f5\n1a379834-6135-41e7-9cf7-e79a9f705fbc\n1cce886d-1841-4e18-963b-15f2e90a3c44\n1e8e5806-2e99-4002-b62c-7a78a6641874\n1f1769de-42fa-4883-b37c-f0de488de557\n240187f4-b097-4a3c-a6fa-2ca5b1e0b373\n25f07256-3b46-4531-aa3e-e1729d9aa7cb\n274f61dd-3fed-4bfe-9aa6-8a012339a41f\n27a0f05f-41fa-43f1-86b9-7e48bde3d716\n2a942be2-9252-4d60-9483-3651a92192a5\n2c0c5f0d-6ad7-4c97-b1a8-2c706d03a4f8\n39309b80-cef5-4ce1-b215-0719723c4c30\n3c159c86-0e90-47d1-ad37-788c00ba2948\n3f78ca48-011c-4ffb-abfa-c9f659e4a820\n3ffd4715-4991-4bc8-9c51-2e3aeb6e737e\n3G1S91V5ZA5fB56W\n48353b4f-51f9-4961-bcc1-c8d5163a8978\n4d6a57e9-e692-4da2-8ba8-adb25645e4b8\n4e1ac580-d3cf-4961-81eb-072dff249c17\n4e5e7d5e-a1fe-4de7-ad53-5f4aaecd7402\n55731fe5-97ad-47dc-953f-37a8aca1451b\n5962654a-a395-4714-96f2-2419ab2172bf\n5e76294a-2787-4ae2-9ddc-b792b0c45ec2\n60f8896b-a437-4e79-9e29-96522ca88c4c\n62e64ec9-d662-4595-bf77-634764dcf810\n67f4e0eb-54cc-4779-b3c3-fe277c8478ae\n6b264507-ba91-4d85-86c9-1e827315cbe0\n722cbc3c-acc8-4296-a8dd-7d06e5ca7d57\n7eb5ccec-3fd7-4826-b681-02a6129aa108\n81baf7c7-3010-49b9-9f56-d53fca06c04d\n85e6784c-7904-41ee-99b4-8b286e19da70\n8AZB70HDFK0WOZIZ\n8f1a37f6-9cff-447e-a00c-cb19512de134\n9b765102-98e7-43e2-a003-f8cbdfab8a64\n9f093bf8-480b-414c-a8e8-5d9c6da83576\n\nhttps://research.nccgroup.com/2020/06/23/wastedlocker-a-new-ransomware-variant-developed-by-the-evil-corp-group/\n\n18/21\n\n\f6/30/2020\n\nWastedLocker: A New Ransomware Variant Developed By The Evil Corp Group \u2013 NCC Group Research\n\n9f7e0dc2-bc5c-497e-aa70-f8072e71550c\nab7d92f2-968a-461e-9da6-e569dedb0a91\nARScenes\nASUSNet20\nATYNKAJP30Z9AQ\nb22d1dd8-e3ea-4764-ba9b-0ebf41fddee7\nb3e32042-d969-43d1-b20c-bcf8da5ba436\nbeb41e13-5e33-450f-a9c5-3e5a382d224d\nBiosChecksumChecker\nbitcoreguard\nBlueEye\nc3c2a8b3-fc8a-4fe3-8f24-6f2a757a5012\nca1b68fd-56d5-4355-94b2-ed6ab0857890\nCBKZiOPASRHKL\nCDNetStreamer2.r05\ncf3573d5-bf4f-4094-bbea-ced8efde2257\nChina1839099\nChina4150039\nCryptoMaxima\nD1JozWrldD\nd86a1229-2cb7-409b-a3de-5366eec3db90\nd8ba5865-ac00-4df1-8437-eb144077e031\ndad17f2e-5f30-4313-b1c3-5ae8c2149757\ndec0f5aa-1fd1-458f-916c-693887610891\ne3024a8f-3f2b-4e06-ac36-0997c1090d00\ned3a7d1d-ed6f-4c8f-86d4-44dcde3b32f8\nf1e7974a-30e1-423c-9745-bbb7ff7dbf71\nf378f238-6503-4544-8e43-cbe4bbf3615e\nf967041f-20dd-4d31-a34a-f5e04bdfdf7b\nFamilyWeekend\nfbac80bd-ba6a-4cd5-92d9-3a31a87f7af6\nfda765a3-b5a2-4417-9097-3b18dc6fe6fb\nfe711d65-f31a-4c22-a12f-cec65d231941\nFixLCD\nFMPsDSCV0l\nFoloDrite\nHk4kKLL0ZAF8a\nHTTPBalancer_v2.15\nI0N8129AZR1A\nImageCreator_v4.2\nInRAMQueue\nIntelBIOSReader\nIwS01003993\nJerkPatrol\nJKLSXX1ZA1QRLER\nKDOWEtRVAB\nLenovoSuite\nMaverickMeerkat\nMDISequencer\nMK5Cheats\nMLIXNJ9AEGPSE\nMLIXNJAEGPSE\n\nhttps://research.nccgroup.com/2020/06/23/wastedlocker-a-new-ransomware-variant-developed-by-the-evil-corp-group/\n\n19/21\n\n\f6/30/2020\n\nWastedLocker: A New Ransomware Variant Developed By The Evil Corp Group \u2013 NCC Group Research\n\nMovieFinder\nN800HANOI\nNattyNarwhal\nNeoNetPlasma\nNeonRhythmbox\nNetRegistry\nNetworkLighter\nNHO9AZB7HDK0WAZMM\nNMOZAQcxzER\nNNDRIOZ8933\nOMXBJSJ3WA1ZIN\nOneiricOcelot\nOnlineShopFinder\nP79zA00FfF3\nPCV5ATULCN\nPJOQT7WD1SAOM\nPrecisePangolin\nPSHZ73VLLOAFB\nQOSUser2.r10\nQuantalQuetzal\nRaringRingtail\nRaspberryManualViewer\nRedParrot\nRouteMatrix\nSoloWrite\nsqlcasheddbm\nSSDOptimizerV13\nStreamCoder1.0\nTropic819331\nUEFIConfig\nUtopicUnicorn\nVHO9AZB7HDK0WAZMM\nVideoBind\nVirginPoint\nVirtualDesktopKeeper\nVirtualPrinterDriver\nVividVervet\nVRK1AlIXBJDA5U3A\nWinDuplicity\nWireDefender\nwwallmutex\n\nCom-\nmands\nexecut-\ned\n\nC:\\Windows\\system32\\WindowsPowershell\\v1.0\\powershell.exe Set-Mp-\nPreference -DisableBehaviorMonitoring $true ; Set-MpPreference -MAP-\nSReporting 0 ; Set-MpPreference -ExclusionProcess rundll32.exe ; Set-Mp-\nPreference -ExclusionExtension dll\n\n\u00a0C:\\Windows\\System32\\netsh.exe advfirewall firewall add rule\nname=\u201dRundll32\u2033 dir=out action=allow protocol=any\nprogram=\u201dC:\\Windows\\system32\\rundll32.exe\u201d\n\nhttps://research.nccgroup.com/2020/06/23/wastedlocker-a-new-ransomware-variant-developed-by-the-evil-corp-group/\n\n20/21\n\n\f6/30/2020\n\nWastedLocker: A New Ransomware Variant Developed By The Evil Corp Group \u2013 NCC Group Research\n\nhttps://research.nccgroup.com/2020/06/23/wastedlocker-a-new-ransomware-variant-developed-by-the-evil-corp-group/\n\n21/21\n\n\f"], "URLs": ["https://research.nccgroup.com/2020/06/23/wastedlocker-a-new-ransomware-variant-developed-by-the-evil-corp-group/", "http://code.jquery.com/"], "weight": 0.0}